smartctl 7.5 2025-04-30 r5714 [x86_64-linux-6.18.33_1] (local build)
Copyright (C) 2002-25, Bruce Allen, Christian Franke, www.smartmontools.org

=== START OF INFORMATION SECTION ===
Model Family:     Seagate Barracuda 7200.12
Device Model:     ST3500413AS
Serial Number:    Z2A6LYYH
LU WWN Device Id: 5 000c50 0355a2fa8
Firmware Version: JC4B
User Capacity:    500,107,862,016 bytes [500 GB]
Sector Size:      512 bytes logical/physical
Rotation Rate:    7200 rpm
Device is:        In smartctl database 7.5/5706
ATA Version is:   ATA8-ACS T13/1699-D revision 4
SATA Version is:  SATA 3.0, 6.0 Gb/s (current: 3.0 Gb/s)
Local Time is:    Thu Jun 11 10:11:48 2026 IST
SMART support is: Available - device has SMART capability.
SMART support is: Enabled

=== START OF READ SMART DATA SECTION ===
SMART overall-health self-assessment test result: PASSED

General SMART Values:
Offline data collection status:  (0x82)	Offline data collection activity
					was completed without error.
					Auto Offline Data Collection: Enabled.
Self-test execution status:      (   0)	The previous self-test routine completed
					without error or no self-test has ever 
					been run.
Total time to complete Offline 
data collection: 		(  600) seconds.
Offline data collection
capabilities: 			 (0x7b) SMART execute Offline immediate.
					Auto Offline data collection on/off support.
					Suspend Offline collection upon new
					command.
					Offline surface scan supported.
					Self-test supported.
					Conveyance Self-test supported.
					Selective Self-test supported.
SMART capabilities:            (0x0003)	Saves SMART data before entering
					power-saving mode.
					Supports SMART auto save timer.
Error logging capability:        (0x01)	Error logging supported.
					General Purpose Logging supported.
Short self-test routine 
recommended polling time: 	 (   1) minutes.
Extended self-test routine
recommended polling time: 	 (  84) minutes.
Conveyance self-test routine
recommended polling time: 	 (   2) minutes.
SCT capabilities: 	       (0x103f)	SCT Status supported.
					SCT Error Recovery Control supported.
					SCT Feature Control supported.
					SCT Data Table supported.

SMART Attributes Data Structure revision number: 10
Vendor Specific SMART Attributes with Thresholds:
ID# ATTRIBUTE_NAME          FLAG     VALUE WORST THRESH TYPE      UPDATED  WHEN_FAILED RAW_VALUE
  1 Raw_Read_Error_Rate     0x000f   093   088   006    Pre-fail  Always       -       150370054
  3 Spin_Up_Time            0x0003   100   100   000    Pre-fail  Always       -       0
  4 Start_Stop_Count        0x0032   096   096   020    Old_age   Always       -       4362
  5 Reallocated_Sector_Ct   0x0033   100   100   036    Pre-fail  Always       -       0
  7 Seek_Error_Rate         0x000f   081   060   030    Pre-fail  Always       -       134735346
  9 Power_On_Hours          0x0032   095   095   000    Old_age   Always       -       4541
 10 Spin_Retry_Count        0x0013   100   100   097    Pre-fail  Always       -       0
 12 Power_Cycle_Count       0x0032   096   096   020    Old_age   Always       -       4354
183 Runtime_Bad_Block       0x0032   100   100   000    Old_age   Always       -       0
184 End-to-End_Error        0x0032   100   100   099    Old_age   Always       -       0
187 Reported_Uncorrect      0x0032   001   001   000    Old_age   Always       -       1621
188 Command_Timeout         0x0032   100   099   000    Old_age   Always       -       0 0 88
189 High_Fly_Writes         0x003a   100   100   000    Old_age   Always       -       0
190 Airflow_Temperature_Cel 0x0022   060   049   045    Old_age   Always       -       40 (Min/Max 37/40)
194 Temperature_Celsius     0x0022   040   051   000    Old_age   Always       -       40 (0 18 0 0 0)
195 Hardware_ECC_Recovered  0x001a   042   035   000    Old_age   Always       -       150370054
197 Current_Pending_Sector  0x0012   100   100   000    Old_age   Always       -       5
198 Offline_Uncorrectable   0x0010   100   100   000    Old_age   Offline      -       5
199 UDMA_CRC_Error_Count    0x003e   200   200   000    Old_age   Always       -       0
240 Head_Flying_Hours       0x0000   100   253   000    Old_age   Offline      -       15951h+39m+34.387s
241 Total_LBAs_Written      0x0000   100   253   000    Old_age   Offline      -       1258861858
242 Total_LBAs_Read         0x0000   100   253   000    Old_age   Offline      -       2042246046

SMART Error Log Version: 1
ATA Error Count: 1598 (device log contains only the most recent five errors)
	CR = Command Register [HEX]
	FR = Features Register [HEX]
	SC = Sector Count Register [HEX]
	SN = Sector Number Register [HEX]
	CL = Cylinder Low Register [HEX]
	CH = Cylinder High Register [HEX]
	DH = Device/Head Register [HEX]
	DC = Device Command Register [HEX]
	ER = Error register [HEX]
	ST = Status register [HEX]
Powered_Up_Time is measured from power on, and printed as
DDd+hh:mm:SS.sss where DD=days, hh=hours, mm=minutes,
SS=sec, and sss=millisec. It "wraps" after 49.710 days.

Error 1598 occurred at disk power-on lifetime: 4517 hours (188 days + 5 hours)
  When the command that caused the error occurred, the device was active or idle.

  After command completion occurred, registers were:
  ER ST SC SN CL CH DH
  -- -- -- -- -- -- --
  40 51 00 96 c0 35 0d  Error: UNC at LBA = 0x0d35c096 = 221626518

  Commands leading to the command that caused the error were:
  CR FR SC SN CL CH DH DC   Powered_Up_Time  Command/Feature_Name
  -- -- -- -- -- -- -- --  ----------------  --------------------
  c8 00 08 90 c0 35 ed 00      06:12:51.278  READ DMA
  27 00 00 00 00 00 e0 00      06:12:51.272  READ NATIVE MAX ADDRESS EXT [OBS-ACS-3]
  ec 00 00 00 00 00 a0 00      06:12:51.270  IDENTIFY DEVICE
  ef 03 46 00 00 00 a0 00      06:12:51.268  SET FEATURES [Set transfer mode]
  27 00 00 00 00 00 e0 00      06:12:51.244  READ NATIVE MAX ADDRESS EXT [OBS-ACS-3]

Error 1597 occurred at disk power-on lifetime: 4517 hours (188 days + 5 hours)
  When the command that caused the error occurred, the device was active or idle.

  After command completion occurred, registers were:
  ER ST SC SN CL CH DH
  -- -- -- -- -- -- --
  40 51 00 96 c0 35 0d  Error: UNC at LBA = 0x0d35c096 = 221626518

  Commands leading to the command that caused the error were:
  CR FR SC SN CL CH DH DC   Powered_Up_Time  Command/Feature_Name
  -- -- -- -- -- -- -- --  ----------------  --------------------
  c8 00 08 90 c0 35 ed 00      06:12:48.369  READ DMA
  35 00 00 08 1d 00 e0 00      06:12:48.367  WRITE DMA EXT
  27 00 00 00 00 00 e0 00      06:12:48.361  READ NATIVE MAX ADDRESS EXT [OBS-ACS-3]
  ec 00 00 00 00 00 a0 00      06:12:48.340  IDENTIFY DEVICE
  ef 03 46 00 00 00 a0 00      06:12:48.302  SET FEATURES [Set transfer mode]

Error 1596 occurred at disk power-on lifetime: 4517 hours (188 days + 5 hours)
  When the command that caused the error occurred, the device was active or idle.

  After command completion occurred, registers were:
  ER ST SC SN CL CH DH
  -- -- -- -- -- -- --
  40 51 00 96 c0 35 0d  Error: UNC at LBA = 0x0d35c096 = 221626518

  Commands leading to the command that caused the error were:
  CR FR SC SN CL CH DH DC   Powered_Up_Time  Command/Feature_Name
  -- -- -- -- -- -- -- --  ----------------  --------------------
  c8 00 08 90 c0 35 ed 00      06:12:45.484  READ DMA
  27 00 00 00 00 00 e0 00      06:12:45.478  READ NATIVE MAX ADDRESS EXT [OBS-ACS-3]
  ec 00 00 00 00 00 a0 00      06:12:45.475  IDENTIFY DEVICE
  ef 03 46 00 00 00 a0 00      06:12:45.473  SET FEATURES [Set transfer mode]
  27 00 00 00 00 00 e0 00      06:12:45.453  READ NATIVE MAX ADDRESS EXT [OBS-ACS-3]

Error 1595 occurred at disk power-on lifetime: 4517 hours (188 days + 5 hours)
  When the command that caused the error occurred, the device was active or idle.

  After command completion occurred, registers were:
  ER ST SC SN CL CH DH
  -- -- -- -- -- -- --
  40 51 00 96 c0 35 0d  Error: UNC at LBA = 0x0d35c096 = 221626518

  Commands leading to the command that caused the error were:
  CR FR SC SN CL CH DH DC   Powered_Up_Time  Command/Feature_Name
  -- -- -- -- -- -- -- --  ----------------  --------------------
  c8 00 08 90 c0 35 ed 00      06:12:42.565  READ DMA
  35 00 00 08 1b 00 e0 00      06:12:42.563  WRITE DMA EXT
  35 00 08 00 1a 00 e0 00      06:12:42.558  WRITE DMA EXT
  35 00 00 00 18 00 e0 00      06:12:42.557  WRITE DMA EXT
  27 00 00 00 00 00 e0 00      06:12:42.551  READ NATIVE MAX ADDRESS EXT [OBS-ACS-3]

Error 1594 occurred at disk power-on lifetime: 4517 hours (188 days + 5 hours)
  When the command that caused the error occurred, the device was active or idle.

  After command completion occurred, registers were:
  ER ST SC SN CL CH DH
  -- -- -- -- -- -- --
  40 51 00 96 c0 35 0d  Error: UNC at LBA = 0x0d35c096 = 221626518

  Commands leading to the command that caused the error were:
  CR FR SC SN CL CH DH DC   Powered_Up_Time  Command/Feature_Name
  -- -- -- -- -- -- -- --  ----------------  --------------------
  c8 00 08 90 c0 35 ed 00      06:12:39.640  READ DMA
  35 00 00 00 16 00 e0 00      06:12:39.638  WRITE DMA EXT
  27 00 00 00 00 00 e0 00      06:12:39.633  READ NATIVE MAX ADDRESS EXT [OBS-ACS-3]
  ec 00 00 00 00 00 a0 00      06:12:39.631  IDENTIFY DEVICE
  ef 03 46 00 00 00 a0 00      06:12:39.629  SET FEATURES [Set transfer mode]

SMART Self-test log structure revision number 1
No self-tests have been logged.  [To run self-tests, use: smartctl -t]

SMART Selective self-test log data structure revision number 1
 SPAN  MIN_LBA  MAX_LBA  CURRENT_TEST_STATUS
    1        0        0  Not_testing
    2        0        0  Not_testing
    3        0        0  Not_testing
    4        0        0  Not_testing
    5        0        0  Not_testing
Selective self-test flags (0x0):
  After scanning selected spans, do NOT read-scan remainder of disk.
If Selective self-test is pending on power-up, resume after 0 minute delay.

The above only provides legacy SMART information - try 'smartctl -x' for more

