smartctl 7.5 2025-04-30 r5714 [x86_64-linux-6.18.33_1] (local build)
Copyright (C) 2002-25, Bruce Allen, Christian Franke, www.smartmontools.org

=== START OF INFORMATION SECTION ===
Model Family:     SAMSUNG SpinPoint M7E (AF)
Device Model:     SAMSUNG HM321HI
Serial Number:    S27WJDSZ401682
LU WWN Device Id: 5 0024e9 00344cf3e
Firmware Version: 2AJ10001
User Capacity:    320,072,933,376 bytes [320 GB]
Sector Sizes:     512 bytes logical, 4096 bytes physical
Rotation Rate:    5400 rpm
Form Factor:      2.5 inches
Device is:        In smartctl database 7.5/5706
ATA Version is:   ATA8-ACS T13/1699-D revision 6
SATA Version is:  SATA 2.6, 3.0 Gb/s
Local Time is:    Thu Jun 11 10:06:28 2026 IST
SMART support is: Available - device has SMART capability.
SMART support is: Enabled

=== START OF READ SMART DATA SECTION ===
SMART overall-health self-assessment test result: PASSED

General SMART Values:
Offline data collection status:  (0x00)	Offline data collection activity
					was never started.
					Auto Offline Data Collection: Disabled.
Self-test execution status:      (   0)	The previous self-test routine completed
					without error or no self-test has ever 
					been run.
Total time to complete Offline 
data collection: 		( 4740) seconds.
Offline data collection
capabilities: 			 (0x5b) SMART execute Offline immediate.
					Auto Offline data collection on/off support.
					Suspend Offline collection upon new
					command.
					Offline surface scan supported.
					Self-test supported.
					No Conveyance Self-test supported.
					Selective Self-test supported.
SMART capabilities:            (0x0003)	Saves SMART data before entering
					power-saving mode.
					Supports SMART auto save timer.
Error logging capability:        (0x01)	Error logging supported.
					General Purpose Logging supported.
Short self-test routine 
recommended polling time: 	 (   2) minutes.
Extended self-test routine
recommended polling time: 	 (  79) minutes.
SCT capabilities: 	       (0x003f)	SCT Status supported.
					SCT Error Recovery Control supported.
					SCT Feature Control supported.
					SCT Data Table supported.

SMART Attributes Data Structure revision number: 16
Vendor Specific SMART Attributes with Thresholds:
ID# ATTRIBUTE_NAME          FLAG     VALUE WORST THRESH TYPE      UPDATED  WHEN_FAILED RAW_VALUE
  1 Raw_Read_Error_Rate     0x002f   087   087   051    Pre-fail  Always       -       31069
  2 Throughput_Performance  0x0026   252   252   000    Old_age   Always       -       0
  3 Spin_Up_Time            0x0023   093   093   025    Pre-fail  Always       -       2259
  4 Start_Stop_Count        0x0032   100   100   000    Old_age   Always       -       100
  5 Reallocated_Sector_Ct   0x0033   252   252   010    Pre-fail  Always       -       0
  7 Seek_Error_Rate         0x002e   252   252   051    Old_age   Always       -       0
  8 Seek_Time_Performance   0x0024   252   252   015    Old_age   Offline      -       0
  9 Power_On_Hours          0x0032   252   252   000    Old_age   Always       -       0
 10 Spin_Retry_Count        0x0032   252   252   051    Old_age   Always       -       0
 11 Calibration_Retry_Count 0x0032   100   100   000    Old_age   Always       -       17
 12 Power_Cycle_Count       0x0032   100   100   000    Old_age   Always       -       125
191 G-Sense_Error_Rate      0x0022   100   100   000    Old_age   Always       -       76
192 Power-Off_Retract_Count 0x0022   252   252   000    Old_age   Always       -       0
194 Temperature_Celsius     0x0002   064   059   000    Old_age   Always       -       32 (Min/Max 31/41)
195 Hardware_ECC_Recovered  0x003a   100   100   000    Old_age   Always       -       0
196 Reallocated_Event_Count 0x0032   252   252   000    Old_age   Always       -       0
197 Current_Pending_Sector  0x0032   077   076   000    Old_age   Always       -       973
198 Offline_Uncorrectable   0x0030   252   252   000    Old_age   Offline      -       0
199 UDMA_CRC_Error_Count    0x0036   200   200   000    Old_age   Always       -       0
200 Multi_Zone_Error_Rate   0x002a   252   252   000    Old_age   Always       -       220
223 Load_Retry_Count        0x0032   100   100   000    Old_age   Always       -       17
225 Load_Cycle_Count        0x0032   100   100   000    Old_age   Always       -       532

SMART Error Log Version: 1
ATA Error Count: 29 (device log contains only the most recent five errors)
	CR = Command Register [HEX]
	FR = Features Register [HEX]
	SC = Sector Count Register [HEX]
	SN = Sector Number Register [HEX]
	CL = Cylinder Low Register [HEX]
	CH = Cylinder High Register [HEX]
	DH = Device/Head Register [HEX]
	DC = Device Command Register [HEX]
	ER = Error register [HEX]
	ST = Status register [HEX]
Powered_Up_Time is measured from power on, and printed as
DDd+hh:mm:SS.sss where DD=days, hh=hours, mm=minutes,
SS=sec, and sss=millisec. It "wraps" after 49.710 days.

Error 29 occurred at disk power-on lifetime: 0 hours (0 days + 0 hours)
  When the command that caused the error occurred, the device was active or idle.

  After command completion occurred, registers were:
  ER ST SC SN CL CH DH
  -- -- -- -- -- -- --
  40 51 01 00 00 00 e0  Error: UNC 1 sectors at LBA = 0x00000000 = 0

  Commands leading to the command that caused the error were:
  CR FR SC SN CL CH DH DC   Powered_Up_Time  Command/Feature_Name
  -- -- -- -- -- -- -- --  ----------------  --------------------
  c8 00 01 00 00 00 e0 08      00:00:00.158  READ DMA
  27 00 00 00 00 00 e0 08      00:00:00.158  READ NATIVE MAX ADDRESS EXT [OBS-ACS-3]
  ec 00 00 00 00 00 a0 08      00:00:00.158  IDENTIFY DEVICE
  ef 03 46 00 00 00 a0 08      00:00:00.158  SET FEATURES [Set transfer mode]
  27 00 00 00 00 00 e0 08      00:00:00.158  READ NATIVE MAX ADDRESS EXT [OBS-ACS-3]

Error 28 occurred at disk power-on lifetime: 0 hours (0 days + 0 hours)
  When the command that caused the error occurred, the device was active or idle.

  After command completion occurred, registers were:
  ER ST SC SN CL CH DH
  -- -- -- -- -- -- --
  40 51 01 00 00 00 e0  Error: UNC 1 sectors at LBA = 0x00000000 = 0

  Commands leading to the command that caused the error were:
  CR FR SC SN CL CH DH DC   Powered_Up_Time  Command/Feature_Name
  -- -- -- -- -- -- -- --  ----------------  --------------------
  c8 00 01 00 00 00 e0 08      00:00:00.156  READ DMA
  25 00 01 ae ea 42 e0 08      00:00:00.156  READ DMA EXT
  25 00 01 af ea 42 e0 08      00:00:00.156  READ DMA EXT
  27 00 00 00 00 00 e0 08      00:00:00.156  READ NATIVE MAX ADDRESS EXT [OBS-ACS-3]
  ec 00 00 00 00 00 a0 08      00:00:00.156  IDENTIFY DEVICE

Error 27 occurred at disk power-on lifetime: 0 hours (0 days + 0 hours)
  When the command that caused the error occurred, the device was active or idle.

  After command completion occurred, registers were:
  ER ST SC SN CL CH DH
  -- -- -- -- -- -- --
  40 51 08 00 00 00 e0  Error: UNC 8 sectors at LBA = 0x00000000 = 0

  Commands leading to the command that caused the error were:
  CR FR SC SN CL CH DH DC   Powered_Up_Time  Command/Feature_Name
  -- -- -- -- -- -- -- --  ----------------  --------------------
  c8 00 08 00 00 00 e0 08      00:00:00.153  READ DMA
  25 00 08 a0 ea 42 e0 08      00:00:00.153  READ DMA EXT
  25 00 08 00 ea 42 e0 08      00:00:00.153  READ DMA EXT
  27 00 00 00 00 00 e0 08      00:00:00.152  READ NATIVE MAX ADDRESS EXT [OBS-ACS-3]
  ec 00 00 00 00 00 a0 08      00:00:00.152  IDENTIFY DEVICE

Error 26 occurred at disk power-on lifetime: 0 hours (0 days + 0 hours)
  When the command that caused the error occurred, the device was active or idle.

  After command completion occurred, registers were:
  ER ST SC SN CL CH DH
  -- -- -- -- -- -- --
  40 51 08 00 00 00 e0  Error: UNC 8 sectors at LBA = 0x00000000 = 0

  Commands leading to the command that caused the error were:
  CR FR SC SN CL CH DH DC   Powered_Up_Time  Command/Feature_Name
  -- -- -- -- -- -- -- --  ----------------  --------------------
  c8 00 08 00 00 00 e0 08      00:00:00.149  READ DMA
  27 00 00 00 00 00 e0 08      00:00:00.149  READ NATIVE MAX ADDRESS EXT [OBS-ACS-3]
  ec 00 00 00 00 00 a0 08      00:00:00.149  IDENTIFY DEVICE
  ef 03 46 00 00 00 a0 08      00:00:00.149  SET FEATURES [Set transfer mode]
  27 00 00 00 00 00 e0 08      00:00:00.149  READ NATIVE MAX ADDRESS EXT [OBS-ACS-3]

Error 25 occurred at disk power-on lifetime: 0 hours (0 days + 0 hours)
  When the command that caused the error occurred, the device was active or idle.

  After command completion occurred, registers were:
  ER ST SC SN CL CH DH
  -- -- -- -- -- -- --
  40 51 20 00 00 00 e0  Error: UNC 32 sectors at LBA = 0x00000000 = 0

  Commands leading to the command that caused the error were:
  CR FR SC SN CL CH DH DC   Powered_Up_Time  Command/Feature_Name
  -- -- -- -- -- -- -- --  ----------------  --------------------
  c8 00 20 00 00 00 e0 08      00:00:00.147  READ DMA
  ea 00 08 c8 b0 48 e0 08      00:00:00.147  FLUSH CACHE EXT
  27 00 00 00 00 00 e0 08      00:00:00.108  READ NATIVE MAX ADDRESS EXT [OBS-ACS-3]
  ec 00 00 00 00 00 a0 08      00:00:00.108  IDENTIFY DEVICE
  ef 03 46 00 00 00 a0 08      00:00:00.108  SET FEATURES [Set transfer mode]

SMART Self-test log structure revision number 1
No self-tests have been logged.  [To run self-tests, use: smartctl -t]

SMART Selective self-test log data structure revision number 0
Note: revision number not 1 implies that no selective self-test has ever been run
 SPAN  MIN_LBA  MAX_LBA  CURRENT_TEST_STATUS
    1        0        0  Completed [00% left] (0-65535)
    2        0        0  Not_testing
    3        0        0  Not_testing
    4        0        0  Not_testing
    5        0        0  Not_testing
Selective self-test flags (0x0):
  After scanning selected spans, do NOT read-scan remainder of disk.
If Selective self-test is pending on power-up, resume after 0 minute delay.

The above only provides legacy SMART information - try 'smartctl -x' for more

